{
  "schema_version": "aos-observed-action-v0.3",
  "object_id": "aos:actions:ObservedAction:create-candidate-rule-dogfood-unknown",
  "object_kind": "ObservedAction",
  "origin": "SYSTEM_OBSERVED",
  "created_at": "2026-05-14T00:03:00Z",
  "created_by": "scripts/governance/observe_action.py",
  "provenance": {
    "input_refs": ["aos:actions:AIActionDeclaration:create-candidate-rule-dogfood"],
    "collector": "scripts/governance/observe_action.py",
    "digest": "fixture-observed-unknown",
    "signature_refs": []
  },
  "state": "OBSERVED",
  "event_id": "aos:event:ObservedAction:create-candidate-rule-dogfood.000001",
  "prev_event_hash": "GENESIS:ObservedAction",
  "event_hash": "sha256:5502e842785b512cc76e39ff3ecd3bb171f7fb2ca00c8ce20a54f92e680f562e",
  "source_identity": "scripts/governance/observe_action.py",
  "observed_sequence": 1,
  "source_declaration_ref": "aos:actions:AIActionDeclaration:create-candidate-rule-dogfood",
  "observation_sources": [],
  "git_base_ref": "fixture-base",
  "git_head_ref": "fixture-head",
  "observed_files_added": [],
  "observed_files_modified": [],
  "observed_files_deleted": [],
  "observed_receipts": [],
  "observed_registry_entries": [],
  "unknown_observations": ["git_diff_unavailable", "commands_run"],
  "preexisting_dirty_overlap": [],
  "observed_at": "2026-05-14T00:03:00Z",
  "declaration_hash": "fixture-declaration-hash"
}
