{
  "schema_version": "aos-observed-action-v0.3",
  "object_id": "aos:actions:ObservedAction:create-candidate-rule-dogfood-scope-mismatch",
  "object_kind": "ObservedAction",
  "origin": "SYSTEM_OBSERVED",
  "created_at": "2026-05-14T00:02:00Z",
  "created_by": "scripts/governance/observe_action.py",
  "provenance": {
    "input_refs": ["aos:actions:AIActionDeclaration:create-candidate-rule-dogfood"],
    "collector": "scripts/governance/observe_action.py",
    "digest": "fixture-observed-over",
    "signature_refs": []
  },
  "state": "OBSERVED",
  "event_id": "aos:event:ObservedAction:create-candidate-rule-dogfood.000001",
  "prev_event_hash": "GENESIS:ObservedAction",
  "event_hash": "sha256:acb900be534491a8de5fdc38f4ae66e2bf0f4117d10458f28367e508d3b94178",
  "source_identity": "scripts/governance/observe_action.py",
  "observed_sequence": 1,
  "source_declaration_ref": "aos:actions:AIActionDeclaration:create-candidate-rule-dogfood",
  "observation_sources": ["SYSTEM_OBSERVED:git diff --name-status", "SYSTEM_OBSERVED:git status --short", "SYSTEM_OBSERVED:filesystem scan"],
  "git_base_ref": "fixture-base",
  "git_head_ref": "fixture-head",
  "observed_files_added": [],
  "observed_files_modified": [
    "docs/governance/candidate-rule-drafts.jsonl",
    "scripts/governance/verify.py"
  ],
  "observed_files_deleted": [],
  "observed_receipts": [],
  "observed_registry_entries": [],
  "unknown_observations": ["commands_run"],
  "preexisting_dirty_overlap": [],
  "observed_at": "2026-05-14T00:02:00Z",
  "declaration_hash": "fixture-declaration-hash"
}
